<pedidos xmlns:xsi="http://www.w3.org/2001/XMLSchema-instance"
 xsi:noNamespaceSchemaLocation="pedidos.xsd">
    <sucursal codigo="A0000000">
        <pedido>
            <NombreTrab>Airam</NombreTrab>
            <fechaPedido>2022-06-20</fechaPedido>
            <observaciones>Urgente</observaciones>
            <articulos codigo="AAA-000">
                <numeroUds>2</numeroUds>
                <precio>15</precio>
                <obsevaciones></obsevaciones>
                <plazoRev>10</plazoRev>
            </articulos>
        </pedido>
    </sucursal>
</pedidos>